{
  "schemaVersion": 1,
  "id": "fukuoka-2026",
  "meta": {
    "title": "후쿠오카 4박 5일",
    "subtitle": "도시 · 역사 · 축제 · 쇼핑 · 먹거리 · 술",
    "destination": "후쿠오카",
    "startDate": "2026-09-18",
    "endDate": "2026-09-22",
    "timezone": "Asia/Tokyo",
    "locale": "ko-KR",
    "travelers": 2,
    "status": "completed",
    "tags": ["후쿠오카", "히타", "다자이후", "미야지다케"]
  },
  "hero": {
    "eyebrow": "FUKUOKA TRIP PLANNER",
    "headline": ["후쿠오카", "4박 5일"],
    "seal": {
      "primary": "九州",
      "secondary": "FUKUOKA"
    },
    "facts": [
      {
        "id": "arrival",
        "icon": "arrival",
        "label": "9/18 13:40 도착"
      },
      {
        "id": "departure",
        "icon": "departure",
        "label": "9/22 19:40 출발"
      },
      {
        "id": "shared-budget",
        "icon": "budget",
        "label": "공용비 ¥80,000"
      }
    ],
    "accommodation": {
      "name": "Atlas Apartment",
      "detail": "4박 · 2인 · 텐진·다이묘 도보권",
      "address": "후쿠오카시 주오구 다이묘 1초메 1-9",
      "checkIn": "9/18 16:00",
      "checkOut": "9/22 10:00",
      "amount": {
        "amount": 79834,
        "currency": "JPY",
        "display": "¥79,834 / 2인"
      },
      "mapUrl": "https://maps.google.com/?q=1-1-9+Daimyo+Chuo+Ward+Fukuoka"
    },
    "savedMap": {
      "label": "후쿠오카 전체 저장 목록",
      "href": "https://maps.app.goo.gl/DgXaRUgMjiE5ZEkS9?g_st=i",
      "kind": "map",
      "description": "관광 · 쇼핑 · 먹거리 한 번에 보기"
    }
  },
  "itinerary": [
    {
      "id": "day-1",
      "date": "2026-09-18",
      "dateLabel": "9/18 금",
      "title": "DAY 1 · 텐진 / 다이묘",
      "state": "쇼핑 + 야타이",
      "events": [
        {
          "id": "day-1-event-1",
          "timeLabel": "13:40",
          "title": "후쿠오카 공항 도착",
          "description": "입국 수속 → 지하철 → Atlas Apartment 이동"
        },
        {
          "id": "day-1-event-2",
          "timeLabel": "16:00",
          "title": "Atlas Apartment 체크인",
          "description": "짐 정리 후 텐진·미나텐진·다이묘 도보권 이동"
        },
        {
          "id": "day-1-event-3",
          "timeLabel": "16:30 ~",
          "title": "텐진 · 미나텐진 · 다이묘 쇼핑",
          "description": "Standard Products, GU, BOOK OFF, 몽벨, 주류·카메라 매장"
        },
        {
          "id": "day-1-event-4",
          "timeLabel": "저녁",
          "title": "저녁 자유 슬롯",
          "description": "먹거리 후보에서 당일 동선 · 대기시간 · 컨디션에 맞춰 선택"
        }
      ]
    },
    {
      "id": "day-2",
      "date": "2026-09-19",
      "dateLabel": "9/19 토",
      "title": "DAY 2 · 후쿠오카성 / 오호리",
      "state": "회복 + 시내",
      "events": [
        {
          "id": "day-2-event-1",
          "timeLabel": "늦은 오전",
          "title": "여유 있게 하루 시작",
          "description": "전날 이동 피로를 풀고 숙소 주변에서 브런치"
        },
        {
          "id": "day-2-event-2",
          "timeLabel": "오후",
          "title": "후쿠오카성터",
          "description": "마이즈루공원과 성터를 천천히 산책"
        },
        {
          "id": "day-2-event-3",
          "timeLabel": "오후",
          "title": "오호리공원",
          "description": "호수 산책 · 카페 · 휴식"
        },
        {
          "id": "day-2-event-4",
          "timeLabel": "저녁",
          "title": "저녁 자유 슬롯",
          "description": "먹거리 후보에서 당일 동선 · 대기시간 · 컨디션에 맞춰 선택"
        }
      ]
    },
    {
      "id": "day-3",
      "date": "2026-09-20",
      "dateLabel": "9/20 일",
      "title": "DAY 3 · 히타",
      "state": "핵심 원정",
      "events": [
        {
          "id": "day-3-event-1",
          "timeLabel": "09:00",
          "title": "니시테츠 텐진 고속버스터미널",
          "description": "예약 불필요 좌석정원제 · 연휴이므로 일찍 줄서기"
        },
        {
          "id": "day-3-event-2",
          "timeLabel": "09:27",
          "title": "텐진 → 히타",
          "description": "고속버스 히타호 · 11:00 전후 도착 · 왕복 ¥3,580/인"
        },
        {
          "id": "day-3-event-3",
          "timeLabel": "점심",
          "title": "히타마부시 센야",
          "description": "10:30~16:30 · LO 15:30 · 2명 예약 불가, 현장 번호표"
        },
        {
          "id": "day-3-event-4",
          "timeLabel": "오후",
          "title": "삿포로 맥주공장",
          "description": "일요일 정상 영업 · 무료 자유견학 + 유료 테이스팅 · 주문 마감 16:00"
        },
        {
          "id": "day-3-event-5",
          "timeLabel": "15:20 ~",
          "title": "琴ひら温泉 유메산스이",
          "description": "일요일 11:00~21:00 · 최종접수 20:30 · 성인 ¥800 · 밝을 때 계곡 노천탕"
        },
        {
          "id": "day-3-event-6",
          "timeLabel": "17:00 ~",
          "title": "저녁 자유 슬롯",
          "description": "히타 또는 후쿠오카 복귀 후 먹거리 후보 중 유동적으로 선택"
        },
        {
          "id": "day-3-event-7",
          "timeLabel": "18:20",
          "title": "히타 → 텐진 목표편",
          "description": "19:50 도착 예상 · 놓치면 19:00 → 20:30 백업 막차"
        },
        {
          "id": "day-3-event-8",
          "timeLabel": "비상",
          "title": "택시 플랜 B",
          "description": "히타→후쿠오카 약 ¥20,000~25,000+ · 고속도로비 별도 가능"
        }
      ]
    },
    {
      "id": "day-4",
      "date": "2026-09-21",
      "dateLabel": "9/21 월",
      "title": "DAY 4 · 미야지다케",
      "state": "축제 + 2차",
      "events": [
        {
          "id": "day-4-event-1",
          "timeLabel": "09:30 ~ 09:45",
          "title": "하카타역 출발 목표",
          "description": "JR 가고시마 본선 일반/쾌속 · 하카타→후쿠마 약 25분",
          "links": [
            {
              "label": "미야지다케 가는 법",
              "href": "https://m.blog.naver.com/yunni_gongbang/224406531097",
              "kind": "reference"
            }
          ]
        },
        {
          "id": "day-4-event-2",
          "timeLabel": "10:10 ~ 10:20",
          "title": "후쿠마역 도착",
          "description": "버스/택시 약 5분 · 도보 약 25분 · 버스 편도 약 ¥210"
        },
        {
          "id": "day-4-event-3",
          "timeLabel": "10:30 ~ 10:45",
          "title": "미야지다케 신사 도착",
          "description": "참배 후 11:15 전에 제1주차장 특설회장·오모테산도 주변 관람 위치 확보"
        },
        {
          "id": "day-4-event-4",
          "timeLabel": "12:00",
          "title": "추계대제 어신행렬 오쿠다리",
          "description": "미야지다케 신사→미야지하마 약 2km · 2026.09.18 공식 발표 기준",
          "links": [
            {
              "label": "2026 추계대제 공식 일정",
              "href": "https://www.miyajidake.or.jp/news/topics/%E7%A7%8B%E5%AD%A3%E5%A4%A7%E7%A5%AD%E8%A1%8C%E4%BA%8B%E6%97%A5%E7%A8%8B",
              "kind": "reference"
            }
          ]
        },
        {
          "id": "day-4-event-5",
          "timeLabel": "복귀",
          "title": "후쿠마 → 하카타",
          "description": "출발 직전 Google Maps로 실시간 최적 경로 재검색"
        },
        {
          "id": "day-4-event-6",
          "timeLabel": "저녁",
          "title": "저녁 자유 슬롯",
          "description": "먹거리 후보에서 당일 동선 · 대기시간 · 컨디션에 맞춰 선택"
        }
      ]
    },
    {
      "id": "day-5",
      "date": "2026-09-22",
      "dateLabel": "9/22 화",
      "title": "DAY 5 · 다자이후",
      "state": "역사 + 귀국",
      "events": [
        {
          "id": "day-5-event-1",
          "timeLabel": "10:00",
          "title": "체크아웃 → Bounce 짐 보관",
          "description": "텐진역 인근 Tenjin Station North Exit · 앱 예약 · 짐 2개 ¥1,700"
        },
        {
          "id": "day-5-event-2",
          "timeLabel": "10:30 전후",
          "title": "니시테츠 후쿠오카(텐진)역 출발",
          "description": "짐 없이 니시테츠 전철로 다자이후 이동"
        },
        {
          "id": "day-5-event-3",
          "timeLabel": "11:30 ~ 14:00",
          "title": "다자이후 텐만구",
          "description": "참배 · 산도 산책 · 점심 · 우메가에모치"
        },
        {
          "id": "day-5-event-4",
          "timeLabel": "14:30",
          "title": "다자이후 출발",
          "description": "출국 여유를 위해 늦어도 14:30에는 텐진으로 복귀"
        },
        {
          "id": "day-5-event-5",
          "timeLabel": "15:30 전후",
          "title": "텐진 도착 → 짐 회수",
          "description": "Bounce에서 짐을 찾고 공항으로 이동"
        },
        {
          "id": "day-5-event-6",
          "timeLabel": "16:00 ~ 16:30",
          "title": "후쿠오카 공항 도착 목표",
          "description": "국제선 수속 시간을 넉넉하게 확보"
        },
        {
          "id": "day-5-event-7",
          "timeLabel": "19:40",
          "title": "후쿠오카 출발",
          "description": "여유 있게 공항 도착"
        }
      ]
    }
  ],
  "sections": [
    {
      "id": "sights",
      "type": "cards",
      "navLabel": "관광",
      "eyebrow": "PLACES",
      "title": "관광 포인트",
      "items": [
        {
          "id": "sight-1",
          "title": "히타",
          "description": "마메다마치 · 히타마부시 · 삿포로 맥주공장 · 유메산스이 · 히타 야키소바를 하루에 연결"
        },
        {
          "id": "sight-2",
          "title": "다자이후 텐만구",
          "description": "니시테츠 텐진 출발. 참배와 산도, 우메가에모치까지 묶는 반나절"
        },
        {
          "id": "sight-3",
          "title": "미야지다케 신사",
          "description": "9/21 공휴일·축제일. 12:00 추계대제 어신행렬 오쿠다리 관람"
        },
        {
          "id": "sight-4",
          "title": "후쿠오카성터 + 오호리공원",
          "description": "도착 다음 날 늦게 시작해 여행 피로를 풀며 걷는 시내 산책 코스"
        }
      ]
    },
    {
      "id": "transport",
      "type": "cards",
      "navLabel": "교통",
      "eyebrow": "TRANSIT",
      "title": "교통 상세",
      "items": [
        {
          "id": "transport-1",
          "title": "버스 승차법 · 현금/교통계 IC",
          "description": "앞·옆면 행선지 확인 → 승차구에서 현금은 정리권을 뽑고, nimoca·SUGOCA·Suica 등 교통계 IC는 터치 → 내릴 정류장 안내 후 벨 → 앞문에서 현금은 정리권+정확한 운임, IC는 다시 터치하고 하차. IC는 정리권을 뽑지 않는다.",
          "links": [
            {
              "label": "니시테츠 공식 승·하차 안내",
              "href": "https://www.nishitetsu.jp/bus/norikata/norikata/",
              "kind": "reference"
            },
            {
              "label": "nimoca 버스 이용법",
              "href": "https://www.nimoca.jp/use/bus",
              "kind": "reference"
            }
          ]
        },
        {
          "id": "transport-2",
          "title": "해외카드 컨택리스 · 버스",
          "description": "일반 니시테츠 노선버스 전체가 대상은 아니었다. 여행 당시 가능 노선은 하카타역↔후쿠오카공항 국제선, Fukuoka BRT, 다자이후 라이너버스 타비토(旅人), 후쿠오카↔구마모토 히노쿠니호. 승차·하차 모두 같은 카드/휴대폰을 터치한다.",
          "links": [
            {
              "label": "니시테츠 터치결제 대상 노선",
              "href": "https://nishitetsu.jp/bus/norikata/tap-to-ride/",